{
  "schemaVersion": "qa-diseno-hibrido/v1.1",
  "hu": "HU06",
  "caso": "HU06-CP02",
  "escenario": "Masivo Autos — Worker AI, Estructurar información y reglas de Placa en Detalle Polizas Asociadas",
  "objetivo": "Validar la radicación Masiva para la línea Autos, verificando el formulario inicial, la ruta Masiva y las reglas de Estructurar Información relacionadas con la consulta por Placa.",
  "nativo": {
    "motor": "sde",
    "referencia": "projects/seguros-del-estado/escenarios/4-hu06-cp02.yaml",
    "sha256": "9bf15a2dbbc24d0b10e96f9785d16aaabba2cabaa8eaadff00a0eb2b84e3f67a"
  },
  "fuentes": [
    {
      "id": "matriz",
      "referencia": "projects/seguros-del-estado/fuentes/matriz.json",
      "localizador": "HU06-CP02, pasos 1 a 22",
      "sha256": "c9048540fde4635f5a79b672a4096a0689bd9a402235b1ab814c4c5b90b515e5"
    },
    {
      "id": "datasets",
      "referencia": "projects/seguros-del-estado/data/datasets.yaml",
      "localizador": "INI-AUTOS-MASIVO y EST-FILA-AUTOS-PLACA; autorizacion sintetica documentada",
      "sha256": "e979582411a4c87ac3bd53f698f57968c5fed74a4b665ab8018f86cb2da693d9"
    },
    {
      "id": "escenario",
      "referencia": "projects/seguros-del-estado/escenarios/4-hu06-cp02.yaml",
      "localizador": "Escenario oficial expandido por el cargador SDE",
      "sha256": "9bf15a2dbbc24d0b10e96f9785d16aaabba2cabaa8eaadff00a0eb2b84e3f67a"
    },
    {
      "id": "presentacion",
      "referencia": "projects/seguros-del-estado/data/expectativas-presentacion.yaml",
      "localizador": "Expectativas del formulario y de Estructurar informacion",
      "sha256": "df64e3f756af51dce752484df19ace01b53c11d0ebf89a1b8e15dacfec4a22e7"
    },
    {
      "id": "popups",
      "referencia": "projects/seguros-del-estado/data/popups-calibrados.yaml",
      "localizador": "detalle-polizas-autos",
      "sha256": "8511e1a4f8be9b1737a989437c9415ce2448a4063055a02af9eff4b73a799a0d"
    }
  ],
  "actores": [
    {
      "id": "intermediario",
      "rol": "Intermediario (radica y completa información)",
      "referenciaLogica": "intermediario",
      "fuente": "datasets"
    },
    {
      "id": "analista",
      "rol": "Analista Centro de Expedición (Estructurar Información; Requirement 230849)",
      "referenciaLogica": "analista",
      "fuente": "datasets"
    }
  ],
  "precondiciones": [
    {
      "id": "QA-DATOS",
      "descripcion": "Contar con cuentas QA habilitadas y opciones parametricas vigentes. No se certifica su disponibilidad en esta fase.",
      "fuente": "escenario",
      "datos": [
        "CFG-PROCESO.proceso",
        "CFG-PROCESO.categoria",
        "INI-AUTOS-MASIVO.ramo",
        "INI-AUTOS-MASIVO.movimiento",
        "INI-AUTOS-MASIVO.sucursal"
      ]
    },
    {
      "id": "POPUP-SEGURO",
      "descripcion": "Aplicar P-06, P-15 y UI-10 en el runner existente; el contrato no autoriza abrir pop-ups ni crear casos.",
      "fuente": "popups",
      "datos": []
    }
  ],
  "datos": [
    {
      "id": "CFG-PROCESO.proceso",
      "campo": "proceso",
      "uso": "SCENARIO",
      "resolucion": "TEST_DATA",
      "sensibilidad": "public",
      "naturaleza": "publico",
      "modo": "referencia",
      "referencia": "SDE_PROCESO_RADICACION",
      "fuente": "datasets",
      "valoresValidos": [],
      "valoresInvalidos": []
    },
    {
      "id": "CFG-PROCESO.categoria",
      "campo": "categoria",
      "uso": "SCENARIO",
      "resolucion": "TEST_DATA",
      "sensibilidad": "public",
      "naturaleza": "publico",
      "modo": "referencia",
      "referencia": "SDE_PROCESO_CATEGORIA",
      "fuente": "datasets",
      "valoresValidos": [],
      "valoresInvalidos": []
    },
    {
      "id": "INI-AUTOS-MASIVO.linea",
      "campo": "linea",
      "uso": "SCENARIO",
      "resolucion": "CASE_LITERAL",
      "sensibilidad": "public",
      "naturaleza": "publico",
      "modo": "literal",
      "valor": "Autos",
      "fuente": "datasets",
      "valoresValidos": [],
      "valoresInvalidos": []
    },
    {
      "id": "INI-AUTOS-MASIVO.ramo",
      "campo": "ramo",
      "uso": "SCENARIO",
      "resolucion": "TEST_DATA",
      "sensibilidad": "public",
      "naturaleza": "publico",
      "modo": "referencia",
      "referencia": "SDE_AUTOS_RAMO",
      "fuente": "datasets",
      "valoresValidos": [],
      "valoresInvalidos": []
    },
    {
      "id": "INI-AUTOS-MASIVO.movimiento",
      "campo": "movimiento",
      "uso": "SCENARIO",
      "resolucion": "TEST_DATA",
      "sensibilidad": "public",
      "naturaleza": "publico",
      "modo": "referencia",
      "referencia": "SDE_AUTOS_MOVIMIENTO",
      "fuente": "datasets",
      "valoresValidos": [],
      "valoresInvalidos": []
    },
    {
      "id": "INI-AUTOS-MASIVO.sucursal",
      "campo": "sucursal",
      "uso": "SCENARIO",
      "resolucion": "TEST_DATA",
      "sensibilidad": "public",
      "naturaleza": "publico",
      "modo": "referencia",
      "referencia": "SDE_SUCURSAL",
      "fuente": "datasets",
      "valoresValidos": [],
      "valoresInvalidos": []
    },
    {
      "id": "INI-AUTOS-MASIVO.tipo_radicacion",
      "campo": "tipo_radicacion",
      "uso": "SCENARIO",
      "resolucion": "CASE_LITERAL",
      "sensibilidad": "public",
      "naturaleza": "publico",
      "modo": "literal",
      "valor": "Masiva",
      "fuente": "datasets",
      "valoresValidos": [],
      "valoresInvalidos": []
    },
    {
      "id": "INI-AUTOS-MASIVO.narrativa",
      "campo": "narrativa",
      "uso": "SCENARIO",
      "resolucion": "GENERATED",
      "sensibilidad": "public",
      "naturaleza": "sintetico-permitido",
      "modo": "literal",
      "valor": "Ref. QA ${unico}.",
      "fuente": "datasets",
      "autorizacionSintetico": "datasets",
      "valoresValidos": [],
      "valoresInvalidos": []
    },
    {
      "id": "INI-AUTOS-MASIVO.narrativa_polizas",
      "campo": "narrativa_polizas",
      "uso": "SCENARIO",
      "resolucion": "GENERATED",
      "sensibilidad": "public",
      "naturaleza": "sintetico-permitido",
      "modo": "literal",
      "valor": "Se solicita realizar la modificación de las pólizas de automóviles 100245678 y 1109876543, asociadas a los vehículos de placas ABC123 y XYZ987, y de la póliza 9023456781 del vehículo de placa KLM456. El cambio corresponde a la actualización de la información registrada, manteniendo sin cambios los datos que no hagan parte del ajuste solicitado.",
      "fuente": "datasets",
      "autorizacionSintetico": "datasets",
      "valoresValidos": [],
      "valoresInvalidos": []
    },
    {
      "id": "EST-FILA-AUTOS-PLACA.placa",
      "campo": "placa",
      "uso": "SCENARIO",
      "resolucion": "GENERATED",
      "sensibilidad": "public",
      "naturaleza": "sintetico-permitido",
      "modo": "literal",
      "valor": "DEF456",
      "fuente": "datasets",
      "autorizacionSintetico": "datasets",
      "valoresValidos": [
        "EST-FILA-AUTOS-PLACA.placa_nueva_fila"
      ],
      "valoresInvalidos": [
        "EST-FILA-AUTOS-PLACA.placa_larga"
      ]
    },
    {
      "id": "EST-FILA-AUTOS-PLACA.placa_nueva_fila",
      "campo": "placa_nueva_fila",
      "uso": "SCENARIO",
      "resolucion": "GENERATED",
      "sensibilidad": "public",
      "naturaleza": "sintetico-permitido",
      "modo": "literal",
      "valor": "GHJ789",
      "fuente": "datasets",
      "autorizacionSintetico": "datasets",
      "valoresValidos": [],
      "valoresInvalidos": []
    },
    {
      "id": "EST-FILA-AUTOS-PLACA.placa_larga",
      "campo": "placa_larga",
      "uso": "SCENARIO",
      "resolucion": "GENERATED",
      "sensibilidad": "public",
      "naturaleza": "sintetico-permitido",
      "modo": "literal",
      "valor": "MNP4567",
      "fuente": "datasets",
      "autorizacionSintetico": "datasets",
      "valoresValidos": [],
      "valoresInvalidos": []
    }
  ],
  "pasos": [
    {
      "id": "P1",
      "matriz": 1,
      "actor": "analista",
      "accion": "Objetivo:",
      "campos": [],
      "datos": [],
      "dependeDe": [],
      "esperado": "Validar la radicación Masiva para la línea Autos, verificando el formulario inicial, la ruta Masiva y las reglas de Estructurar Información relacionadas con la consulta por Placa.",
      "fuente": "matriz",
      "modalidad": "hibrido",
      "evidencia": {
        "tipo": "captura-y-revision",
        "descripcion": "Captura real del paso y diagnostico; pendiente hasta ejecucion autorizada."
      },
      "capacidadesNativas": [],
      "responsabilidades": {
        "robot": [
          "Ejecutar una sola vez las capacidades nativas referenciadas, en el orden del plan; registrar resultado y evidencia sin modificar criterios."
        ],
        "analista": [
          "Contrastar la cobertura automatica con el resultado esperado y registrar la parte no demostrada antes de aprobar el diseno o el resultado."
        ],
        "cubiertoAutomaticamente": [
          "Solo las comprobaciones expresas de las capacidades referenciadas; no inferir reglas adicionales por presencia de controles."
        ],
        "pendienteManual": [
          "Revision humana de las partes no sustentadas por comprobaciones explicitas."
        ],
        "evidencias": [
          {
            "tipo": "captura-y-diagnostico",
            "comprobacion": "Resultado original y captura de cada capacidad referenciada; una captura no sustituye las aserciones."
          },
          {
            "tipo": "acta-cobertura-QA",
            "comprobacion": "Relacionar cada parte del objetivo completo con sus comprobaciones y pendientes, fuente y decision del analista."
          }
        ],
        "continuacion": {
          "decide": "analista-QA",
          "condicion": "Registrar decision y evidencia humana de la parte pendiente. No habilita reanudacion automatica en esta fase.",
          "siNoSeCompleta": "cerrar-con-pendiente-sin-reanudar"
        }
      }
    },
    {